{
  "schema_version": "1.0.0",
  "repository": {
    "id": "DonkeyJJLove/ai_platform",
    "url": "https://github.com/DonkeyJJLove/ai_platform",
    "owner": "DonkeyJJLove",
    "default_branch": "master",
    "vcs_ref": null
  },
  "cyber_lion": {
    "tile_id": "control-plane.cyber-lion",
    "roles": [
      "EnterpriseControlPlane",
      "AgentFoundry",
      "SwarmPlanner",
      "FederationRegistry",
      "AuthorityPolicyEngine",
      "ProcessContractIntegration"
    ],
    "layers": [
      "INF",
      "SEM",
      "MAND"
    ],
    "disposition": [
      "KEEP",
      "REFINE",
      "INTEGRATE"
    ]
  },
  "capabilities": [
    "agent.spec",
    "mission.spec",
    "swarm.plan",
    "mosaic.delta",
    "repository.discover",
    "process.contract",
    "process.transition.select",
    "process.action_intent",
    "action.propose",
    "gate.evaluate",
    "execution.receipt",
    "event.envelope"
  ],
  "authority": {
    "maximum_level": "external_write",
    "required_gates": [
      "cyber-lion.mand.policy",
      "independent.verifier"
    ]
  },
  "observability": {
    "logs": [
      "mission.lifecycle",
      "process.transition",
      "swarm.lifecycle",
      "gate.decision",
      "execution.receipt",
      "authority.degradation"
    ],
    "metrics": [
      "swarm.count",
      "gate.allow",
      "gate.deny",
      "observability.coverage",
      "authority.expansion.count"
    ],
    "traces": [
      "evidence→process→action-intent→proposal→gate→runtime-admission→effect→observation→reconciliation→process-state"
    ]
  },
  "security": {
    "trust_boundaries": [
      "repository registration != credentials",
      "AgentSpec != runtime identity",
      "ProcessContract != authority",
      "ProcessTransition != action execution",
      "ActionIntentCandidate != ActionSpec",
      "GateDecision != external side effect",
      "model proposal != authority",
      "authority expansion requires independent deterministic gate",
      "consequential execution requires causal gate binding and observable receipt",
      "receipt != observation != reconciliation"
    ]
  },
  "epistemic": {
    "status": "ENGINEERING_CANDIDATE",
    "confidence": 0.88
  },
  "architecture_knowledge": {
    "schema_version": "1.0.0",
    "global_owner": "DonkeyJJLove/ai_platform",
    "semantic_exports": [
      "architecture",
      "federation",
      "repository_roles",
      "contracts",
      "capabilities",
      "authority",
      "runtime",
      "currentness",
      "formalization",
      "roadmap",
      "RAG"
    ],
    "semantic_imports": [
      "process_semantics",
      "evolution_compiler",
      "context_memory",
      "hypothesis_research",
      "structure_graph",
      "supply_chain_provenance",
      "execution_mesh",
      "simulation",
      "research_corpus"
    ],
    "repository_dependencies": [],
    "architecture_artifacts": [
      {
        "path": "README.md",
        "class": "HUMAN_ARCHITECTURE_DOCUMENT",
        "currentness": "LOCAL_OWNER"
      },
      {
        "path": "LION/README.md",
        "class": "HUMAN_ARCHITECTURE_DOCUMENT",
        "currentness": "LOCAL_OWNER"
      },
      {
        "path": "AGENTS.md",
        "class": "HUMAN_ARCHITECTURE_DOCUMENT",
        "currentness": "LOCAL_OWNER"
      },
      {
        "path": "LION/architecture/v1_5/README.md",
        "class": "HUMAN_ARCHITECTURE_DOCUMENT",
        "currentness": "LOCAL_OWNER"
      },
      {
        "path": "LION/architecture/v1_5/semantic_owners.json",
        "class": "MACHINE_READABLE_ARCHITECTURE",
        "currentness": "SOURCE_BOUND"
      },
      {
        "path": "LION/architecture/v1_5/FORMALIZATION_REGISTRY_FEDERATION_R1.json",
        "class": "MACHINE_READABLE_ARCHITECTURE",
        "currentness": "SOURCE_BOUND"
      },
      {
        "path": "LION/architecture/v1_5/ARCHITECTURE_DOCUMENT_CENSUS.json",
        "class": "GENERATED_PROJECTION",
        "currentness": "GENERATED"
      },
      {
        "path": "LION/architecture/v1_5/ARCHITECTURE_DOCUMENT_GRAPH.json",
        "class": "GENERATED_PROJECTION",
        "currentness": "GENERATED"
      },
      {
        "path": "LION/architecture/v1_5/CODE_DERIVED_ARCHITECTURE.json",
        "class": "GENERATED_PROJECTION",
        "currentness": "GENERATED"
      },
      {
        "path": "LION/architecture/v1_5/DOCUMENT_DERIVED_ARCHITECTURE.json",
        "class": "GENERATED_PROJECTION",
        "currentness": "GENERATED"
      },
      {
        "path": "LION/architecture/v1_5/ARCHITECTURE_RECONCILIATION.json",
        "class": "GENERATED_PROJECTION",
        "currentness": "GENERATED"
      },
      {
        "path": "LION/architecture/v1_5/DOCUMENTATION_CURRENTNESS_MODEL.json",
        "class": "GENERATED_PROJECTION",
        "currentness": "GENERATED"
      },
      {
        "path": "LION/architecture/v1_5/REPOSITORY_ROLE_MATRIX.json",
        "class": "GENERATED_PROJECTION",
        "currentness": "GENERATED"
      },
      {
        "path": "LION/architecture/v1_5/CROSS_REPOSITORY_DEPENDENCY_GRAPH.json",
        "class": "GENERATED_PROJECTION",
        "currentness": "GENERATED"
      },
      {
        "path": "LION/architecture/v1_5/AI_NATIVE_ROADMAP_NEXT.md",
        "class": "ROADMAP",
        "currentness": "SOURCE_BOUND"
      },
      {
        "path": "cyber_lion/TARGET_ARCHITECTURE.md",
        "class": "HUMAN_ARCHITECTURE_DOCUMENT",
        "currentness": "VERSIONED_STATIC"
      },
      {
        "path": "AI_NATIVE_ROADMAP.md",
        "class": "ROADMAP",
        "currentness": "HISTORICAL"
      },
      {
        "path": "LION/architecture/v1_4/federation_current_vector.json",
        "class": "GENERATED_PROJECTION",
        "currentness": "GENERATED"
      },
      {
        "path": "LION/architecture/v1_5/GLOBAL_REPOSITORY_RECONCILIATION_BASELINE_R1.json",
        "class": "MACHINE_READABLE_ARCHITECTURE",
        "currentness": "SOURCE_BOUND"
      },
      {
        "path": "LION/architecture/v1_5/REPOSITORY_CONTENT_CLASSIFICATION.schema.json",
        "class": "SCHEMA",
        "currentness": "VERSIONED_STATIC"
      },
      {
        "path": "LION/standards/README.md",
        "class": "HUMAN_ARCHITECTURE_DOCUMENT",
        "currentness": "LOCAL_OWNER"
      },
      {
        "path": "LION/standards/LION_NAMING_STANDARD.json",
        "class": "MACHINE_READABLE_ARCHITECTURE",
        "currentness": "LOCAL_OWNER"
      },
      {
        "path": "LION/standards/LION_STATUS_MODEL.json",
        "class": "MACHINE_READABLE_ARCHITECTURE",
        "currentness": "LOCAL_OWNER"
      },
      {
        "path": "LION/standards/LION_VERSION_MODEL.json",
        "class": "MACHINE_READABLE_ARCHITECTURE",
        "currentness": "LOCAL_OWNER"
      },
      {
        "path": "LION/panel/README.md",
        "class": "HUMAN_ARCHITECTURE_DOCUMENT",
        "currentness": "LOCAL_OWNER"
      },
      {
        "path": "LION/panel/PANEL_COMPONENT_CATALOG.json",
        "class": "MACHINE_READABLE_ARCHITECTURE",
        "currentness": "SOURCE_BOUND"
      },
      {
        "path": "LION/panel/PANEL_STATE_MODEL.json",
        "class": "MACHINE_READABLE_ARCHITECTURE",
        "currentness": "SOURCE_BOUND"
      },
      {
        "path": "LION/standards/LION_REPOSITORY_LAYOUT_STANDARD.json",
        "class": "MACHINE_READABLE_ARCHITECTURE",
        "currentness": "LOCAL_OWNER"
      },
      {
        "path": "LION/standards/LION_CURRENTNESS_EVIDENCE_MODEL.json",
        "class": "MACHINE_READABLE_ARCHITECTURE",
        "currentness": "LOCAL_OWNER"
      },
      {
        "path": "LION/standards/LION_GENERATED_OUTPUT_POLICY.json",
        "class": "MACHINE_READABLE_ARCHITECTURE",
        "currentness": "LOCAL_OWNER"
      }
    ],
    "discoverability": {
      "entrypoint": "AGENTS.md",
      "global_owner_route": "AGENTS.md -> LION/architecture/v1_5/README.md -> semantic owners/formalization registry -> LION/standards + LION/panel; README.md -> LION/README.md -> LION/architecture/v1_5/README.md",
      "max_reads_to_global_owner": 3
    },
    "invalidation_triggers": [
      "SOURCE_CHANGE",
      "CONTRACT_CHANGE",
      "CAPABILITY_CHANGE",
      "SEMANTIC_OWNER_CHANGE",
      "FLOW_CHANGE",
      "RUNTIME_OBSERVATION",
      "CURRENTNESS_CHANGE",
      "RAG_RELEASE",
      "REPOSITORY_ROLE_CHANGE",
      "DEPENDENCY_CHANGE",
      "NAMING_STANDARD_CHANGE",
      "STATUS_MODEL_CHANGE",
      "VERSION_MODEL_CHANGE",
      "PANEL_CONTRACT_CHANGE",
      "REPOSITORY_CONTENT_CHANGE"
    ]
  }
}
